{
  "schemaVersion": 2,
  "tool": {
    "name": "pharn-ci",
    "version": "0.1.0"
  },
  "verdict": "warn",
  "diffCoverage": null,
  "agentSetup": {
    "files": [],
    "summary": {
      "byKind": {},
      "tools": []
    },
    "missing": [
      "claude-code",
      "cursor"
    ]
  },
  "messages": [
    {
      "level": "warn",
      "code": "DIFF_UNAVAILABLE",
      "text": "Diff coverage was not computed: no diff available"
    },
    {
      "level": "info",
      "code": "NO_AGENT_SETUP_FILES",
      "text": "No agent setup files (CLAUDE.md, AGENTS.md, .cursor/rules, ...) were found."
    },
    {
      "level": "warn",
      "code": "AGENT_SETUP_EXPECTED_MISSING",
      "text": "No agent setup file configures the expected tools: claude-code, cursor."
    }
  ],
  "testIntegrity": {
    "mode": "warn",
    "source": "default",
    "verdict": "pass",
    "signals": [],
    "languages": []
  }
}
